<?xml version="1.0" encoding="UTF-8" ?>
<xs:schema xmlns:xs="http://www.w3.org/2001/XMLSchema">

	<xs:element name="ERmodell">
		<xs:complexType>
			<xs:all>
				<xs:element name="A" type="aType" />
				<xs:element name="B" type="bType" />
				<xs:element name="C" type="cType" />
				<xs:element name="AtoB" type="atoBType" />
			</xs:all>
		</xs:complexType>
	</xs:element>

	<xs:complexType name="aType">
		<xs:all>
			<xs:element name="b" type="a_bType" />
			<xs:element name="c" />
		</xs:all>
		<xs:attribute name="a" />
	</xs:complexType>

	<xs:complexType name="a_bType">
		<xs:all>
			<xs:element name="x" />
			<xs:element name="y" />
		</xs:all>
	</xs:complexType>

	<xs:complexType name="bType">
		<xs:all>
			<xs:element name="b" type="b_bType" />
		</xs:all>
		<xs:attribute name="a" />
	</xs:complexType>

	<xs:complexType name="b_bType">
		<xs:all>
			<xs:element name="x" />
			<xs:element name="y" />
		</xs:all>
	</xs:complexType>

	<xs:complexType name="cType">
		<xs:all>
			<xs:element name="b" />
		</xs:all>
		<xs:attribute name="a" />
	</xs:complexType>

	<xs:complexType name="atoBType">
		<xs:all>
			<xs:element name="c" />
		</xs:all>
		<xs:attribute name="aID" />
		<xs:attribute name="bID" />
	</xs:complexType>


</xs:schema>